{
  "$schema": "https://json-schema.org/draft/2020-12/schema",
  "type": "object",
  "additionalProperties": false,
  "required": [
    "schema_version",
    "request_id",
    "status",
    "executor_account",
    "executor_label",
    "executor_sandbox",
    "exit_code",
    "started_at",
    "finished_at",
    "summary",
    "files_changed",
    "commands_run",
    "tests",
    "remaining_issues",
    "git_status",
    "diff_file",
    "run_directory"
  ],
  "properties": {
    "schema_version": {"type": "integer", "const": 1},
    "request_id": {"type": "string"},
    "parent_request_id": {"type": ["string", "null"]},
    "status": {"type": "string", "enum": ["completed", "failed", "invalid_request", "executor_unavailable", "cancelled"]},
    "executor_account": {"type": "string"},
    "executor_label": {"type": "string"},
    "executor_sandbox": {"type": "string", "enum": ["", "read-only", "workspace-write"]},
    "exit_code": {"type": ["integer", "null"]},
    "started_at": {"type": "string"},
    "finished_at": {"type": "string"},
    "summary": {"type": "string"},
    "repository": {"type": "string"},
    "files_changed": {"type": "array", "items": {"type": "string"}},
    "commands_run": {"type": "array", "items": {"type": "string"}},
    "tests": {
      "type": "array",
      "items": {
        "type": "object",
        "additionalProperties": false,
        "required": ["command", "status", "details"],
        "properties": {
          "command": {"type": "string"},
          "status": {"type": "string", "enum": ["passed", "failed", "not_run"]},
          "details": {"type": "string"}
        }
      }
    },
    "remaining_issues": {"type": "array", "items": {"type": "string"}},
    "memory_updates": {
      "type": "array",
      "items": {
        "type": "object",
        "additionalProperties": false,
        "required": ["kind", "subject", "content", "evidence"],
        "properties": {
          "kind": {"type": "string", "enum": ["decision", "architecture", "workflow", "constraint", "discovery"]},
          "subject": {"type": "string", "minLength": 1},
          "content": {"type": "string", "minLength": 1},
          "evidence": {"type": "string", "minLength": 1}
        }
      }
    },
    "git_status": {"type": "string"},
    "diff_file": {"type": "string"},
    "run_directory": {"type": "string"},
    "executor_report_file": {"type": "string"},
    "stderr_file": {"type": "string"},
    "terminal_session_id": {"type": "string"},
    "terminal_turn_start": {"type": "string"},
    "task_transport": {"type": "string", "enum": ["", "file", "inline", "app_server"]},
    "task_artifact": {"type": "string"},
    "task_sha256": {"type": "string", "pattern": "^[a-f0-9]{64}$|^$"},
    "reuse_existing": {"type": "boolean"},
    "reuse_provenance": {
      "type": "object",
      "additionalProperties": false,
      "required": ["mode"],
      "properties": {
        "mode": {"type": "string", "enum": ["reuse_or_start", "strict_existing"]},
        "terminal_session_id": {"type": "string", "minLength": 1},
        "session_record": {"type": "string", "minLength": 1},
        "session_host_pid": {"type": "integer", "minimum": 1},
        "terminal_pid": {"type": "integer", "minimum": 1},
        "host_pid": {"type": "integer", "minimum": 1},
        "session_process_epoch": {"type": "string", "minLength": 1},
        "session_process_start_identity": {"type": "string"},
        "account": {"type": "string", "minLength": 1},
        "account_label": {"type": "string"},
        "role": {"type": "string", "minLength": 1},
        "repository_identity": {"type": "string", "minLength": 1},
        "codex_home_identity": {"type": "string", "minLength": 1},
        "codex_session_id": {"type": "string"},
        "repository": {"type": "string"},
        "codex_home": {"type": "string"},
        "pid": {"type": "integer", "minimum": 1},
        "process_started_at": {"type": "number", "minimum": 0},
        "pipe": {"type": "string"},
        "viewer_attached": {"type": "boolean"},
        "viewer_pid": {"type": "integer", "minimum": 0},
        "viewer_epoch": {"type": "string"},
        "target_model": {"type": "string"},
        "target_reasoning": {"type": "string"},
        "model_provenance": {"type": "string", "enum": ["tui_readiness", "unavailable"]},
        "reasoning_provenance": {"type": "string", "enum": ["tui_readiness", "unavailable"]}
      }
    },
    "app_server_thread_id": {"type": "string"},
    "app_server_turn_id": {"type": "string"},
    "app_server_process_id": {"type": "string"},
    "executor_windows_sandbox": {"type": "string", "enum": ["", "unspecified", "elevated", "unelevated"]},
    "executor_windows_sandbox_readiness": {"type": "string", "enum": ["", "not_checked", "not_required", "not_applicable", "ready", "notConfigured", "updateRequired"]},
    "executor_approval_policy": {"type": "string", "enum": ["", "never", "on-request"]},
    "executor_role": {"type": "string"},
    "executor_provider": {"type": "string", "enum": ["", "antigravity"]},
    "antigravity_conversation_id": {"type": "string"},
    "antigravity_terminal_status": {"type": "string"},
    "error": {"type": "string"}
  },
  "allOf": [
    {
      "if": {
        "required": ["reuse_existing"],
        "properties": {
          "reuse_existing": {"const": true},
          "status": {"const": "completed"}
        }
      },
      "then": {
        "required": ["reuse_provenance"],
        "properties": {
          "reuse_provenance": {
            "required": [
              "mode",
              "terminal_session_id",
              "session_record",
              "session_host_pid",
              "terminal_pid",
              "host_pid",
              "session_process_epoch",
              "account",
              "role",
              "repository_identity",
              "codex_home_identity",
              "codex_session_id"
            ]
          }
        }
      }
    }
  ]
}
