{
  "schema_version": 1,
  "request_id": "aip-phase12-android-duplex-counter-20260822",
  "parent_request_id": null,
  "status": "failed",
  "executor_account": "biel4",
  "executor_label": "bielxdh4@gmail.com",
  "executor_sandbox": "workspace-write",
  "exit_code": 0,
  "started_at": "2026-08-22T16:59:37.311722+00:00",
  "finished_at": "2026-08-22T17:00:39.832520+00:00",
  "summary": "Fixed duplex counter synchronization and committed as 5617d2b.",
  "files_changed": [
    "android/app/src/main/java/com/aip/companion/Protocol.kt",
    "android/app/src/test/java/com/aip/companion/ProtocolTest.kt"
  ],
  "commands_run": [
    "./gradlew.bat testDebugUnitTest",
    "./gradlew.bat lintDebug",
    "./gradlew.bat assembleDebug",
    "Get-FileHash -Algorithm SHA256 app/build/outputs/apk/debug/app-debug.apk",
    "git diff --check",
    "git commit -m \"fix: sync phase 12 duplex counters\"",
    "git status --short"
  ],
  "tests": [
    {
      "command": "testDebugUnitTest",
      "status": "passed",
      "details": "Passed with Kotlin fallback compilation."
    },
    {
      "command": "lintDebug",
      "status": "passed",
      "details": "BUILD SUCCESSFUL."
    },
    {
      "command": "assembleDebug",
      "status": "passed",
      "details": "BUILD SUCCESSFUL."
    },
    {
      "command": "SHA-256 app-debug.apk",
      "status": "passed",
      "details": "06DB1C753B07618AB3BA12286E9C33B9D0F6818733393F3B66BFA00A416273F8"
    },
    {
      "command": "git diff --check",
      "status": "passed",
      "details": "No diff errors."
    }
  ],
  "remaining_issues": [
    "Kotlin daemon emitted access-denied warnings and used fallback compilation.",
    "No physical-device, private-LAN, or release-signing validation performed.",
    "Git HEAD changed during delegation; inspect the commit manually."
  ],
  "git_status": "",
  "diff_file": "C:\\Users\\bielx\\3D Objects\\Dual-Codex-worktree\\runs\\20260822T165937Z-aip-phase12-android-duplex-counter-20260822\\git-diff.md",
  "run_directory": "C:\\Users\\bielx\\3D Objects\\Dual-Codex-worktree\\runs\\20260822T165937Z-aip-phase12-android-duplex-counter-20260822",
  "executor_report_file": "C:\\Users\\bielx\\3D Objects\\Dual-Codex-worktree\\runs\\20260822T165937Z-aip-phase12-android-duplex-counter-20260822\\executor-report.json",
  "stderr_file": "C:\\Users\\bielx\\3D Objects\\Dual-Codex-worktree\\runs\\20260822T165937Z-aip-phase12-android-duplex-counter-20260822\\executor.stderr.log",
  "terminal_session_id": "",
  "terminal_turn_start": "",
  "app_server_thread_id": "01a02a63-9209-7be2-8af4-08b9c61c3fa5",
  "app_server_turn_id": "01a02a69-e533-76f1-83ea-d23c131dc317",
  "app_server_process_id": "2732",
  "task_transport": "app_server",
  "task_artifact": "C:\\Users\\bielx\\3D Objects\\Dual-Codex-worktree\\runs\\executor-task-artifacts\\20260822T165937Z-aip-phase12-android-duplex-counter-20260822.md",
  "task_sha256": "626773246557ffeac386467951298fe96cc1f35d949e2b9d2fcc6ab016e6817c",
  "reuse_existing": false,
  "reuse_provenance": {
    "mode": "reuse_or_start"
  },
  "error": "Executor produced a valid report but did not apply any repository changes. Executor changed Git HEAD; no rollback was attempted."
}
