{
  "schema_version": 1,
  "request_id": "aip-phase12-transport-lifecycle-20260822",
  "parent_request_id": "aip-phase12-transport-lifecycle-20260822",
  "status": "failed",
  "executor_account": "biel4",
  "executor_label": "bielxdh4@gmail.com",
  "executor_sandbox": "workspace-write",
  "exit_code": 0,
  "started_at": "2026-08-22T16:11:43.613927+00:00",
  "finished_at": "2026-08-22T16:15:19.743043+00:00",
  "summary": "Resolved the secure Phase 12 transport lifecycle blockers and committed 09b8ea3.",
  "files_changed": [
    "apps/desktop/src-tauri/src/companion_transport.rs"
  ],
  "commands_run": [
    "cargo fmt",
    "cargo fmt --check",
    "cargo check --locked",
    "cargo clippy --locked --all-targets -- -D warnings",
    "cargo test --locked --lib companion_transport",
    "cargo test --locked --lib",
    "git diff --check",
    "git commit -m 'fix: bound phase 12 transport lifecycle'"
  ],
  "tests": [
    {
      "command": "cargo fmt --check",
      "status": "passed",
      "details": "Formatting passed."
    },
    {
      "command": "cargo check --locked",
      "status": "passed",
      "details": "Rust crate check passed."
    },
    {
      "command": "cargo clippy --locked --all-targets -- -D warnings",
      "status": "passed",
      "details": "Clippy passed without warnings."
    },
    {
      "command": "cargo test --locked --lib companion_transport",
      "status": "passed",
      "details": "5 focused transport lifecycle tests passed, including one-time pairing, rotation/revocation, loopback exchange, and idempotent stop."
    },
    {
      "command": "cargo test --locked --lib",
      "status": "passed",
      "details": "130 passed, 1 ignored, 0 failed."
    },
    {
      "command": "git diff --check",
      "status": "passed",
      "details": "No whitespace errors."
    },
    {
      "command": "git status --short --branch",
      "status": "passed",
      "details": "Clean branch after commit."
    }
  ],
  "remaining_issues": [
    "Tauri/SQLite/Android integration remains deferred to the subsequent scoped commit.",
    "Git HEAD changed during delegation; inspect the commit manually."
  ],
  "git_status": "",
  "diff_file": "C:\\Users\\bielx\\3D Objects\\Dual-Codex-worktree\\runs\\20260822T161143Z-aip-phase12-transport-lifecycle-20260822\\git-diff.md",
  "run_directory": "C:\\Users\\bielx\\3D Objects\\Dual-Codex-worktree\\runs\\20260822T161143Z-aip-phase12-transport-lifecycle-20260822",
  "executor_report_file": "C:\\Users\\bielx\\3D Objects\\Dual-Codex-worktree\\runs\\20260822T161143Z-aip-phase12-transport-lifecycle-20260822\\executor-report.json",
  "stderr_file": "C:\\Users\\bielx\\3D Objects\\Dual-Codex-worktree\\runs\\20260822T161143Z-aip-phase12-transport-lifecycle-20260822\\executor.stderr.log",
  "terminal_session_id": "",
  "terminal_turn_start": "",
  "app_server_thread_id": "01a02a2d-a524-7c21-955c-f7cf0ed10fa3",
  "app_server_turn_id": "01a02a3e-0c00-7282-848e-ff6d7ae8765d",
  "app_server_process_id": "15920",
  "task_transport": "app_server",
  "task_artifact": "C:\\Users\\bielx\\3D Objects\\Dual-Codex-worktree\\runs\\executor-task-artifacts\\20260822T161143Z-aip-phase12-transport-lifecycle-20260822.md",
  "task_sha256": "809367ed16ae9ad83a1e1c8d92bd939efbba470e901b63ba925de7ad48358556",
  "reuse_existing": false,
  "reuse_provenance": {
    "mode": "reuse_or_start"
  },
  "error": "Executor produced a valid report but did not apply any repository changes. Executor changed Git HEAD; no rollback was attempted."
}
