{
  "schema_version": 1,
  "request_id": "prompt-arena-p4-algorithms-finalize-20260828",
  "parent_request_id": "prompt-arena-p4-algorithms-20260828",
  "status": "failed",
  "executor_account": "biel4",
  "executor_label": "bielxdh4@gmail.com",
  "executor_sandbox": "workspace-write",
  "exit_code": 1,
  "started_at": "2026-08-28T14:09:29.199327+00:00",
  "finished_at": "2026-08-28T14:19:33.818414+00:00",
  "summary": "Codex executor failed; repository modifications, if any, were preserved.",
  "files_changed": [
    "src-tauri/src/storage.rs",
    "src/advanced-arena.ts",
    "src/arena-runner.ts",
    "src/bridge.ts"
  ],
  "commands_run": [],
  "tests": [],
  "remaining_issues": [],
  "git_status": "M  src-tauri/src/storage.rs\nA  src/advanced-arena.ts\nM  src/arena-runner.ts\nM  src/bridge.ts\n",
  "diff_file": "C:\\Users\\bielx\\3D Objects\\Dual-Codex-worktree\\runs\\20260828T140929Z-prompt-arena-p4-algorithms-finalize-20260828\\git-diff.md",
  "run_directory": "C:\\Users\\bielx\\3D Objects\\Dual-Codex-worktree\\runs\\20260828T140929Z-prompt-arena-p4-algorithms-finalize-20260828",
  "executor_report_file": "",
  "stderr_file": "C:\\Users\\bielx\\3D Objects\\Dual-Codex-worktree\\runs\\20260828T140929Z-prompt-arena-p4-algorithms-finalize-20260828\\executor.stderr.log",
  "terminal_session_id": "",
  "terminal_turn_start": "",
  "app_server_thread_id": "",
  "app_server_turn_id": "",
  "app_server_process_id": "",
  "executor_windows_sandbox": "",
  "executor_windows_sandbox_readiness": "not_checked",
  "executor_approval_policy": "never",
  "executor_role": "executor",
  "task_transport": "app_server",
  "task_artifact": "C:\\Users\\bielx\\3D Objects\\Dual-Codex-worktree\\runs\\executor-task-artifacts\\20260828T140929Z-prompt-arena-p4-algorithms-finalize-20260828.md",
  "task_sha256": "ea584f1d96ebfdb435757bd414c7e93cadf9231d6e14e8433a0e70f2658aa365",
  "reuse_existing": false,
  "reuse_provenance": {
    "mode": "reuse_or_start"
  },
  "error": "Executor exited with code 1."
}
