{
  "schema_version": 1,
  "request_id": "prompt-arena-native-local-artifact-smoke-20260829",
  "parent_request_id": null,
  "status": "failed",
  "executor_account": "biel4",
  "executor_label": "bielxdh4@gmail.com",
  "executor_sandbox": "workspace-write",
  "exit_code": 0,
  "started_at": "2026-08-29T13:30:20.198136+00:00",
  "finished_at": "2026-08-29T13:36:42.043143+00:00",
  "summary": "Local native acceptance was attempted with the supplied prebuilt tools and failed at WebDriver session creation: `session not created from chrome not reachable`. Product SHA is f3048a61f45cdb6b29f362444f3d32646edf4943. No source, policy, commit, push, or original-WIP changes occurred. Executor provenance: BL4/biel4, Executor, App Server/headless, readiness=ready, approval=never, workspace-write; elevated sandbox and app-server thread/turn IDs were not exposed.",
  "files_changed": [
    ".native-tools/native-ui-smoke-20260829.stdout.log",
    ".native-tools/native-ui-smoke-20260829.stderr.log"
  ],
  "commands_run": [
    "git branch --show-current; git rev-parse HEAD; git status --short; git diff --exit-code -- .",
    "Read-only manifest and binary SHA-256 verification",
    "Prepend .native-tools to PATH and probe tauri-driver/msedgedriver paths and versions",
    "node scripts/native-ui-smoke.mjs src-tauri/target/release/prompt-arena.exe",
    "Read-only WebView2, RemoteDebuggingAllowed, UDF ACL, process, and port diagnostics"
  ],
  "tests": [
    {
      "command": "Manifest and tool artifact verification",
      "status": "passed",
      "details": "Manifest workflowRunId 33254907801; manifest sourceCommit 55d685fbdbd927a5ab195ab141fa76ea823acf96; manifest SHA-256 7D39BD12861B5F1F7781876275D34FD54236BB42433E4DF5E3F0F7DBC50CAB48. tauri-driver.exe at E:\\Prompt Arena-native-local-20260829-pr\\.native-tools\\tauri-driver.exe, version 2.0.6, SHA-256 e37974bf5a76fc97b2282af19489f8f516d4d367318dc0c124fe292f88e33e01. msedgedriver.exe at E:\\Prompt Arena-native-local-20260829-pr\\.native-tools\\msedgedriver.exe, version Microsoft Edge WebDriver 151.0.4129.101, SHA-256 3684b7096da7aced2ddb627cca12d9e59a8e69378bd8ec1e09cc8f2a7d47b87a."
    },
    {
      "command": "Product artifact verification",
      "status": "passed",
      "details": "App E:\\Prompt Arena-native-local-20260829-pr\\src-tauri\\target\\release\\prompt-arena.exe SHA-256 BC632933E2B5DAD72EF907522B10D1E16D5869EEAFDAE714DCB133D74C4C361E. Worker E:\\Prompt Arena-native-local-20260829-pr\\src-tauri\\target\\release\\prompt-arena-worker.exe SHA-256 4E34773C5B30504292CF867D76D9734640C948798223C5EAE8132DA162D654F5."
    },
    {
      "command": "Native Tauri smoke",
      "status": "failed",
      "details": "Exit code 1. stdout exactly: `Native Tauri acceptance app: E:\\Prompt Arena-native-local-20260829-pr\\src-tauri\\target\\release\\prompt-arena.exe` and `Host: win32 10.0.19045`. stderr exactly reached `Error: WebDriver POST /session failed (500): session not created from chrome not reachable` at scripts/native-ui-smoke.mjs:38, during startSession at line 59 and firstSession at line 210. No acceptance marker, WINDOWS_NATIVE_TAURI_ACCEPTANCE_LOCAL_PASS, or run_id was produced."
    },
    {
      "command": "Runtime provenance",
      "status": "passed",
      "details": "Edge executable C:\\Program Files (x86)\\Microsoft\\Edge\\Application\\msedge.exe ProductVersion 151.0.4129.107. WebView2 executable C:\\Program Files (x86)\\Microsoft\\EdgeWebView\\Application\\151.0.4129.107\\msedgewebview2.exe ProductVersion 151.0.4129.107; registry version 151.0.4129.107."
    },
    {
      "command": "Failure diagnostics",
      "status": "passed",
      "details": "All checked RemoteDebuggingAllowed policy values were absent. Smoke UDF directories had Modify ACLs. No prompt-arena, worker, tauri-driver, or msedgedriver processes remained; no relevant listeners on ports 4444, 9515, 9222, or 9223."
    },
    {
      "command": "Source integrity",
      "status": "passed",
      "details": "Branch validation/native-tauri-acceptance at exact SHA f3048a61f45cdb6b29f362444f3d32646edf4943; git diff --exit-code returned 0. Only authorized smoke logs and pre-existing temporary tool/cache directories are untracked."
    }
  ],
  "remaining_issues": [
    "The native WebView2 session failed locally with `session not created from chrome not reachable`; the bridge, Rust command, sidecar, persistence, close/reopen, and persisted-run assertions were not reached.",
    "Manifest sourceCommit 55d685fbdbd927a5ab195ab141fa76ea823acf96 differs from product SHA f3048a61f45cdb6b29f362444f3d32646edf4943; both values are preserved for provenance.",
    "No RemoteDebuggingAllowed policy was disabled, and no policy workaround was attempted.",
    "Phase review verdict: Approved with reservations. Security review found no changed controls. No publication or remote action occurred; hosted CI classification is not applicable because local session creation failed."
  ],
  "git_status": "?? .native-driver-cargo-retry-20260829/\n?? .native-tools/\n",
  "diff_file": "C:\\Users\\bielx\\3D Objects\\Dual-Codex-worktree\\runs\\20260829T133020Z-prompt-arena-native-local-artifact-smoke-20260829\\git-diff.md",
  "run_directory": "C:\\Users\\bielx\\3D Objects\\Dual-Codex-worktree\\runs\\20260829T133020Z-prompt-arena-native-local-artifact-smoke-20260829",
  "executor_report_file": "C:\\Users\\bielx\\3D Objects\\Dual-Codex-worktree\\runs\\20260829T133020Z-prompt-arena-native-local-artifact-smoke-20260829\\executor-report.json",
  "stderr_file": "C:\\Users\\bielx\\3D Objects\\Dual-Codex-worktree\\runs\\20260829T133020Z-prompt-arena-native-local-artifact-smoke-20260829\\executor.stderr.log",
  "terminal_session_id": "",
  "terminal_turn_start": "",
  "app_server_thread_id": "01a04d64-1a5e-7a22-8a03-7b99bf7069b5",
  "app_server_turn_id": "01a04db6-cd85-7363-92fc-ebf6e2821039",
  "app_server_process_id": "1232",
  "executor_windows_sandbox": "elevated",
  "executor_windows_sandbox_readiness": "ready",
  "executor_approval_policy": "never",
  "executor_role": "executor",
  "task_transport": "app_server",
  "task_artifact": "C:\\Users\\bielx\\3D Objects\\Dual-Codex-worktree\\runs\\executor-task-artifacts\\20260829T133020Z-prompt-arena-native-local-artifact-smoke-20260829.md",
  "task_sha256": "1d47181db5c3e046d62d84dbbb5d39ce0fb73e4f5e8c01280e24512e2bbaadbc",
  "reuse_existing": false,
  "reuse_provenance": {
    "mode": "reuse_or_start"
  },
  "error": "Executor reported a test with status 'failed'."
}
