{
  "schema_version": 1,
  "request_id": "prompt-arena-p4-user-facing-20260828",
  "parent_request_id": null,
  "status": "failed",
  "executor_account": "biel4",
  "executor_label": "bielxdh4@gmail.com",
  "executor_sandbox": "workspace-write",
  "exit_code": 1,
  "started_at": "2026-08-28T14:24:36.625611+00:00",
  "finished_at": "2026-08-28T14:34:37.987864+00:00",
  "summary": "Codex executor failed; repository modifications, if any, were preserved.",
  "files_changed": [
    "src/App.tsx",
    "src/styles.css",
    "src/advanced-arena-ui.test.ts",
    "src/advanced-arena-ui.ts",
    "src/advanced-arena-view.test.tsx",
    "src/advanced-arena-view.tsx"
  ],
  "commands_run": [],
  "tests": [],
  "remaining_issues": [],
  "git_status": " M src/App.tsx\n M src/styles.css\n?? src/advanced-arena-ui.test.ts\n?? src/advanced-arena-ui.ts\n?? src/advanced-arena-view.test.tsx\n?? src/advanced-arena-view.tsx\n",
  "diff_file": "C:\\Users\\bielx\\3D Objects\\Dual-Codex-worktree\\runs\\20260828T142436Z-prompt-arena-p4-user-facing-20260828\\git-diff.md",
  "run_directory": "C:\\Users\\bielx\\3D Objects\\Dual-Codex-worktree\\runs\\20260828T142436Z-prompt-arena-p4-user-facing-20260828",
  "executor_report_file": "",
  "stderr_file": "C:\\Users\\bielx\\3D Objects\\Dual-Codex-worktree\\runs\\20260828T142436Z-prompt-arena-p4-user-facing-20260828\\executor.stderr.log",
  "terminal_session_id": "",
  "terminal_turn_start": "",
  "app_server_thread_id": "",
  "app_server_turn_id": "",
  "app_server_process_id": "",
  "executor_windows_sandbox": "",
  "executor_windows_sandbox_readiness": "not_checked",
  "executor_approval_policy": "never",
  "executor_role": "executor",
  "task_transport": "app_server",
  "task_artifact": "C:\\Users\\bielx\\3D Objects\\Dual-Codex-worktree\\runs\\executor-task-artifacts\\20260828T142436Z-prompt-arena-p4-user-facing-20260828.md",
  "task_sha256": "3b2f9634f6427eea3a3f312ecc08536f0d000335c8025e0e36019d77aea18517",
  "reuse_existing": false,
  "reuse_provenance": {
    "mode": "reuse_or_start"
  },
  "error": "Executor exited with code 1."
}
