{
  "schema_version": 1,
  "request_id": "prompt-arena-p4-core-20260827",
  "parent_request_id": "prompt-arena-p3-review-fix-20260827",
  "status": "failed",
  "executor_account": "biel4",
  "executor_label": "bielxdh4@gmail.com",
  "executor_sandbox": "workspace-write",
  "exit_code": 1,
  "started_at": "2026-08-27T23:41:23.025824+00:00",
  "finished_at": "2026-08-27T23:51:24.451226+00:00",
  "summary": "Codex executor failed; repository modifications, if any, were preserved.",
  "files_changed": [],
  "commands_run": [],
  "tests": [],
  "remaining_issues": [],
  "git_status": "",
  "diff_file": "C:\\Users\\bielx\\3D Objects\\Dual-Codex-worktree\\runs\\20260827T234123Z-prompt-arena-p4-core-20260827\\git-diff.md",
  "run_directory": "C:\\Users\\bielx\\3D Objects\\Dual-Codex-worktree\\runs\\20260827T234123Z-prompt-arena-p4-core-20260827",
  "executor_report_file": "",
  "stderr_file": "C:\\Users\\bielx\\3D Objects\\Dual-Codex-worktree\\runs\\20260827T234123Z-prompt-arena-p4-core-20260827\\executor.stderr.log",
  "terminal_session_id": "",
  "terminal_turn_start": "",
  "app_server_thread_id": "",
  "app_server_turn_id": "",
  "app_server_process_id": "",
  "executor_windows_sandbox": "",
  "executor_windows_sandbox_readiness": "not_checked",
  "executor_approval_policy": "never",
  "executor_role": "executor",
  "task_transport": "app_server",
  "task_artifact": "C:\\Users\\bielx\\3D Objects\\Dual-Codex-worktree\\runs\\executor-task-artifacts\\20260827T234123Z-prompt-arena-p4-core-20260827.md",
  "task_sha256": "157e91cfedec4f4fd2ad1253e5a437af6cf9fb7acb3a5c8610c65bcccafd53d1",
  "reuse_existing": false,
  "reuse_provenance": {
    "mode": "reuse_or_start"
  },
  "error": "Executor exited with code 1."
}
