{
  "schema_version": 1,
  "request_id": "prompt-arena-p2-ui-finalize-20260827",
  "parent_request_id": "prompt-arena-p2-ui-summary-tests-20260827",
  "status": "failed",
  "executor_account": "biel4",
  "executor_label": "bielxdh4@gmail.com",
  "executor_sandbox": "workspace-write",
  "exit_code": 0,
  "started_at": "2026-08-27T22:02:08.090832+00:00",
  "finished_at": "2026-08-27T22:07:05.800963+00:00",
  "summary": "Approved with reservations. Committed P2 UI/summary integration as 952293a395df24feeb5b721193a11bd9b636ab19. Materialization invokes a registered Tauri command; Arena summaries save/read through the bridge. P2 remains IN PROGRESS. Canonical provenance: BL4, biel4, Executor/Reviewer, app_server, no fallback/TUI.",
  "files_changed": [
    "src/App.tsx",
    "src/arena-runner.ts",
    "src/benchmark-ui.ts",
    "src/bridge.ts",
    "src-tauri/src/commands.rs",
    "src-tauri/src/lib.rs",
    "src-tauri/src/storage.rs"
  ],
  "commands_run": [
    "npm test",
    "npm run typecheck",
    "npm run build",
    "npm run check:boundaries",
    "npm run test:boundaries",
    "cargo fmt --all -- --check",
    "cargo check --all-targets",
    "cargo test --all-targets",
    "git diff --check",
    "git commit -m \"feat: finalize P2 UI and summary integration\""
  ],
  "tests": [
    {
      "command": "npm test",
      "status": "passed",
      "details": "12 files, 57 tests passed."
    },
    {
      "command": "npm run typecheck",
      "status": "passed",
      "details": "Passed after relocating the handler and adding missing summary formatters."
    },
    {
      "command": "npm run build",
      "status": "passed",
      "details": "Production Vite build completed."
    },
    {
      "command": "npm run check:boundaries",
      "status": "passed",
      "details": "Repository boundary check passed."
    },
    {
      "command": "npm run test:boundaries",
      "status": "passed",
      "details": "All boundary fixtures passed."
    },
    {
      "command": "cargo fmt --all -- --check",
      "status": "passed",
      "details": "Passed from src-tauri after rustfmt."
    },
    {
      "command": "cargo check --all-targets",
      "status": "passed",
      "details": "All native targets compiled."
    },
    {
      "command": "cargo test --all-targets",
      "status": "passed",
      "details": "79 passed, 0 failed."
    },
    {
      "command": "git diff --check",
      "status": "passed",
      "details": "No whitespace errors; worktree clean after commit."
    },
    {
      "command": "Bridge invoke registration audit",
      "status": "passed",
      "details": "Every bridge invoke, including materialization and Arena summary save/list/get, has a registered Tauri command."
    }
  ],
  "remaining_issues": [
    "Manual native Tauri QA remains for materialization and Arena summary persistence, including Docker-required boundary behavior and local Ollama interaction.",
    "Remote CI is unconfirmed. No P3-P7, motion, merge, tag, release, deploy, or public-release work was performed.",
    "Git HEAD changed during delegation; inspect the commit manually."
  ],
  "git_status": "",
  "diff_file": "C:\\Users\\bielx\\3D Objects\\Dual-Codex-worktree\\runs\\20260827T220208Z-prompt-arena-p2-ui-finalize-20260827\\git-diff.md",
  "run_directory": "C:\\Users\\bielx\\3D Objects\\Dual-Codex-worktree\\runs\\20260827T220208Z-prompt-arena-p2-ui-finalize-20260827",
  "executor_report_file": "C:\\Users\\bielx\\3D Objects\\Dual-Codex-worktree\\runs\\20260827T220208Z-prompt-arena-p2-ui-finalize-20260827\\executor-report.json",
  "stderr_file": "C:\\Users\\bielx\\3D Objects\\Dual-Codex-worktree\\runs\\20260827T220208Z-prompt-arena-p2-ui-finalize-20260827\\executor.stderr.log",
  "terminal_session_id": "",
  "terminal_turn_start": "",
  "app_server_thread_id": "01a0453e-a703-75a1-bd79-891f0d113a77",
  "app_server_turn_id": "01a0453e-a7ad-7bb3-8314-e13200c7a29e",
  "app_server_process_id": "20112",
  "executor_windows_sandbox": "elevated",
  "executor_windows_sandbox_readiness": "ready",
  "executor_approval_policy": "never",
  "executor_role": "executor",
  "task_transport": "app_server",
  "task_artifact": "C:\\Users\\bielx\\3D Objects\\Dual-Codex-worktree\\runs\\executor-task-artifacts\\20260827T220208Z-prompt-arena-p2-ui-finalize-20260827.md",
  "task_sha256": "da4502012cd74fd2161509e00395872188623a14b66d94d9e56f9e807fff97cd",
  "reuse_existing": false,
  "reuse_provenance": {
    "mode": "reuse_or_start"
  },
  "error": "Executor produced a valid report but did not apply any repository changes. Executor changed Git HEAD; no rollback was attempted."
}
