{
  "schema_version": 1,
  "request_id": "prompt-arena-p5-history-close-20260828",
  "parent_request_id": "prompt-arena-p5-history-20260828",
  "status": "failed",
  "executor_account": "biel4",
  "executor_label": "bielxdh4@gmail.com",
  "executor_sandbox": "workspace-write",
  "exit_code": 0,
  "started_at": "2026-08-28T21:06:03.740791+00:00",
  "finished_at": "2026-08-28T21:09:45.977821+00:00",
  "summary": "Closed and committed the focused P5 history diff as c16c995. Worktree is clean.",
  "files_changed": [
    "ROADMAP.md",
    "src-tauri/src/commands.rs",
    "src-tauri/src/external_providers.rs",
    "src-tauri/src/lib.rs",
    "src-tauri/src/storage.rs",
    "src-tauri/src/storage/migrations/0008_external_generation_evidence.sql",
    "src/App.tsx",
    "src/bridge.ts",
    "src/byok-ui.test.ts"
  ],
  "commands_run": [
    "npm run typecheck",
    "npm test",
    "npm run build",
    "cargo fmt --manifest-path src-tauri/Cargo.toml -- --check",
    "cargo check --manifest-path src-tauri/Cargo.toml --all-targets",
    "cargo test --manifest-path src-tauri/Cargo.toml --all-targets",
    "git diff --check",
    "git commit -m 'Close P5 external generation history'"
  ],
  "tests": [
    {
      "command": "npm run typecheck",
      "status": "passed",
      "details": "Passed."
    },
    {
      "command": "npm test",
      "status": "passed",
      "details": "82 tests passed."
    },
    {
      "command": "npm run build",
      "status": "passed",
      "details": "Production build passed."
    },
    {
      "command": "cargo fmt --manifest-path src-tauri/Cargo.toml -- --check",
      "status": "passed",
      "details": "Passed after rustfmt import wrapping."
    },
    {
      "command": "cargo check --manifest-path src-tauri/Cargo.toml --all-targets",
      "status": "passed",
      "details": "Passed after adding Deserialize to ExternalUsage."
    },
    {
      "command": "cargo test --manifest-path src-tauri/Cargo.toml --all-targets",
      "status": "passed",
      "details": "105 tests passed."
    },
    {
      "command": "git diff --check",
      "status": "passed",
      "details": "Passed; only line-ending warnings were emitted."
    }
  ],
  "remaining_issues": [
    "None. No real provider or network calls were made.",
    "Git HEAD changed during delegation; inspect the commit manually."
  ],
  "git_status": "",
  "diff_file": "C:\\Users\\bielx\\3D Objects\\Dual-Codex-worktree\\runs\\20260828T210604Z-prompt-arena-p5-history-close-20260828\\git-diff.md",
  "run_directory": "C:\\Users\\bielx\\3D Objects\\Dual-Codex-worktree\\runs\\20260828T210604Z-prompt-arena-p5-history-close-20260828",
  "executor_report_file": "C:\\Users\\bielx\\3D Objects\\Dual-Codex-worktree\\runs\\20260828T210604Z-prompt-arena-p5-history-close-20260828\\executor-report.json",
  "stderr_file": "C:\\Users\\bielx\\3D Objects\\Dual-Codex-worktree\\runs\\20260828T210604Z-prompt-arena-p5-history-close-20260828\\executor.stderr.log",
  "terminal_session_id": "",
  "terminal_turn_start": "",
  "app_server_thread_id": "01a04a31-ac98-7251-8c81-054051159f89",
  "app_server_turn_id": "01a04a31-ad49-79b2-983e-06524b52fbfc",
  "app_server_process_id": "8756",
  "executor_windows_sandbox": "elevated",
  "executor_windows_sandbox_readiness": "ready",
  "executor_approval_policy": "never",
  "executor_role": "executor",
  "task_transport": "app_server",
  "task_artifact": "C:\\Users\\bielx\\3D Objects\\Dual-Codex-worktree\\runs\\executor-task-artifacts\\20260828T210604Z-prompt-arena-p5-history-close-20260828.md",
  "task_sha256": "e2847b21919a6de2507a25b08e1f3c3388621b06622f88180259f3f8331d1e20",
  "reuse_existing": false,
  "reuse_provenance": {
    "mode": "reuse_or_start"
  },
  "error": "Executor produced a valid report but did not apply any repository changes. Executor changed Git HEAD; no rollback was attempted."
}
